dato_ok.json

[
    {
      "imei": "ZGRUMAD00000001",
      "estado": 1,
      "fecha_procesada": "2026-04-11T11:00:07.866000",
      "fecha_inicio": "2026-04-01T16:31:55.552000",
      "ultimo_dato": {
        "temp_supply_1": 21.9,
        "temp_supply_2": "E01",
        "return_air": 26.3,
        "evaporation_coil": 19.1,
        "condensation_coil": 38.8,
        "compress_coil_1": 63.7,
        "compress_coil_2": "E00",
        "ambient_air": 693.9,
        "cargo_1_temp": -51.1,
        "cargo_2_temp": -38.5,
        "cargo_3_temp": -38.5,
        "cargo_4_temp": -38.5,
        "relative_humidity": 19839,
        "avl": 0,
        "suction_pressure": -5.12,
        "discharge_pressure": -3.85,
        "line_voltage": -12161,
        "line_frequency": 15361,
        "consumption_ph_1": 2867.2,
        "consumption_ph_2": 3200,
        "consumption_ph_3": 3174.4,
        "co2_reading": -51.2,
        "o2_reading": -64.1,
        "evaporator_speed": 15487,
        "condenser_speed": 13824,
        "battery_voltage": 3020.8,
        "power_kwh": 3491.9,
        "power_trip_reading": 3353.6,
        "power_trip_duration": 133041152,
        "suction_temp": -51.2,
        "discharge_temp": -38.5,
        "supply_air_temp": -908.9,
        "return_air_temp": 179.2,
        "dl_battery_temp": -5.11,
        "dl_battery_charge": 1.27,
        "power_consumption": -28.16,
        "power_consumption_avg": 276.5,
        "suction_pressure_2": -5.12,
        "suction_temp_2": -12.9,
        "alarm_present": 1,
        "set_point": 22,
        "capacity_load": 28,
        "power_state": 1,
        "controlling_mode": 0,
        "humidity_control": 1,
        "humidity_set_point": 95,
        "fresh_air_ex_mode": 0,
        "fresh_air_ex_rate": "E01",
        "fresh_air_ex_delay": "E01",
        "set_point_o2": "E01",
        "set_point_co2": "E01",
        "defrost_term_temp": 18,
        "defrost_interval": 6,
        "water_cooled_conde": 0,
        "usda_trip": 0,
        "evaporator_exp_valve": "E98",
        "suction_mod_valve": "E98",
        "hot_gas_valve": "E98",
        "economizer_valve": "E98",
        "campo_1": 85.1,
        "campo_2": 1,
        "campo_3": 1,
        "campo_4": 32516,
        "campo_5": 1051,
        "campo_6": 0,
        "campo_7": 0,
        "campo_8": 0,
        "numero_alarma": 0,
        "alarma_01": -1,
        "alarma_02": -1,
        "alarma_03": -1,
        "alarma_04": -1,
        "alarma_05": -1,
        "alarma_06": -1,
        "alarma_07": -1,
        "alarma_08": -1,
        "alarma_09": -1,
        "alarma_10": -1,
        "imei": "ZGRUMAD00000001",
        "ip": "10.239.31.146,13,0",
        "device": "UNIT111",
        "fecha": "2026-04-07T14:47:24.120000"
      },
      "hasta": "2026-04-07T14:47:24.120000",
      "ultima_fecha_encendido": "2026-04-02T10:28:41.845000",
      "ultimo_power_state": 1,
      "fresh_air_ex_mode": {
        "modo_actual": 0,
        "fecha_modo_actual": "2026-04-02T10:28:41.845000",
        "ultimo_modo_0": "2026-04-02T10:28:41.845000",
        "ultimo_modo_1": null,
        "ultimo_modo_2": null
      },
      "alarmas": {
        "numero_alarma": 0,
        "activas": []
      },
      "compress_coil_1": {
        "estado": "normal",
        "valor_actual": 63.7,
        "fecha_inicio_estado": "2026-04-02T10:28:41.845000",
        "fecha_ultimo_critico": null,
        "fecha_ultimo_normal": "2026-04-02T10:28:41.845000"
      },
      "set_point": {
        "valor": 22,
        "fecha": "2026-04-02T10:28:41.845000",
        "anterior": null
      },
      "humidity_set_point": {
        "valor": 95,
        "fecha": "2026-04-02T10:28:41.845000",
        "anterior": null
      },
      "identificador": "1001"
    }
  ]

ejemplo.md

"fecha_procesada": "2026-04-11T11:00:07.866000", # fecha de la ultima normalizacion de datos
    "fecha_inicio": "2026-04-01T16:31:55.552000", #fecha desde que inicio a llegar los datos de telemetria
    "proceso" : "Manual" , # pude ser automatico , homogenizacion , ventilacion maduracion 
    "id_proceso" :1000001 ,
    "ultimo_dato": {
      "temp_supply_1": 21.9, validacion de [-45 a 50 ] .#Logica si esta alrededor de set_point (+- 5) equipo funcionando estable
      "temp_supply_2": "E01",validacion de [-45 a 50 ]
      "return_air": 26.3, # validacion de [-45 a 50 ]Logica si esta alrededor de  set_point(+-5) el frio esta circulando correctamente y la carga interna del contenedor esta en rango
      "evaporation_coil": 19.1,validacion de [-45 a 50 ] #nromalamnte caundo esta en positivo y return_air y temp_supply_1 estan en negativo es que se activo la resistencia y esta en un proceso de defrost
      "condensation_coil": 38.8,validacion de [-45 a 50 ]
      "compress_coil_1": 63.7, validacion de [-45 a 130 ]# temeparatura d compresor por debajo de 90° esta normal , en un rango de 90 a 100 esta es "esfuerzo" , de 100 a 110 esta sobre-esfuerzo . y mas de 110 es critico
      "compress_coil_2": "E00",validacion de [-45 a 130 ]
      "ambient_air": 693.9, # validacion de [-20 a 60 ]
      "cargo_1_temp": -51.1,# validacion de [-25 a 50 ]
      "cargo_2_temp": -38.5,# validacion de [-25 a 50 ]
      "cargo_3_temp": -38.5,# validacion de [-25 a 50 ]
      "cargo_4_temp": -38.5,# validacion de [-25 a 50 ]
      "relative_humidity": 19839,# validacion de [1 a 99 ]
      "avl": 0,# validacion de [0,225 ]
      "suction_pressure": -5.12,# validacion de [0,225 ]
      "discharge_pressure": -3.85,# validacion de [0,225 ]
      "line_voltage": -12161,# validacion de [0,500 ]
      "line_frequency": 15361,# validacion de [0,80 ]
      "consumption_ph_1": # validacion de [0,20 ]
      "consumption_ph_2": # validacion de [0,20 ]
      "consumption_ph_3": # validacion de [0,20 ]
      "co2_reading": -51.2,# validacion de [0,25 ]
      "o2_reading": -64.1,# validacion de [0,25 ]
      "evaporator_speed": 15487,# validacion de [0,200 ]
      "condenser_speed": 13824,# validacion de [0,200 ]
      "battery_voltage": 3020.8,# validacion de [0,100 ]
      "power_kwh": 3491.9, # validacion solo mayores a 0 
      "power_trip_reading": 3353.6, # validacion solo mayores a 0 
      "power_trip_duration": 133041152, # validacion solo mayores a 0 
      "suction_temp": -51.2,validacion de [-45 a 130 ]
      "discharge_temp": -38.5, validacion de [-45 a 130 ]
      "supply_air_temp": -908.9,validacion de [-45 a 130 ]
      "return_air_temp": 179.2,validacion de [-45 a 130 ]
      "dl_battery_temp": -5.11,validacion de [-45 a 130 ]
      "dl_battery_charge": 1.27,validacion de [0 a 100 ]
      "power_consumption": -28.16, # validacion solo mayores a 0 
      "power_consumption_avg": 276.5, ## validacion solo mayores a 0 
      "suction_pressure_2": -5.12,# validacion de [0,225 ]
      "suction_temp_2": -12.9,# validacion de [0,225 ]
      "alarm_present": 1, de 0 a 20
      "set_point": 22, validacion de [-45 a 50 ]
      "capacity_load": 28,validacion de [0 a 100 ]
      "power_state": 1,es 0 "apagado y 1 encendido
      "controlling_mode": 0, del 0 al 9 modos de funcionamiento
      "humidity_control": 1, 0 apagado , 1 activo 
      "humidity_set_point": 95,validacion de [0 a 100 ]
      "fresh_air_ex_mode": 0, 0 apagado , 1 manual , 2 automatico
      "fresh_air_ex_rate": "E01",# validacion de [0,225 ]
      "fresh_air_ex_delay": "E01",# validacion de [0,225 ]
      "set_point_o2": "E01",# validacion de [0,25 ]
      "set_point_co2": "E01",# validacion de [0,25 ]
      "defrost_term_temp": 18,# validacion de [0,24 ]
      "defrost_interval": 6,# validacion de [0,24 ]
      "water_cooled_conde": 0,# validacion de [0,100 ]
      "usda_trip": 0,# validacion de [0,100 ]
      "evaporator_exp_valve": "E98",# validacion de [0,100 ]
      "suction_mod_valve": "E98", # validacion de [0,100 ]
      "hot_gas_valve": "E98",# validacion de [0,100 ]
      "economizer_valve": "E98",# validacion de [0,100 ]
      "campo_1": 85.1, # validacion de [0,280 ] , es el nivel de lectura del etileno en ppm 
      "campo_2": 1,# validacion de [0,280 ]
      "campo_3": 1,# validacion de [0,280 ]
      "campo_4": 32516,# validacion de [0,280 ]
      "campo_5": 1051,# validacion de [0,280 ]
      "campo_6": 0,# validacion de [0,280 ]
      "campo_7": 0,# validacion de [0,280 ]
      "campo_8": 0,# validacion de [0,280 ]
      "numero_alarma": 0,# validacion de [0,20 ]
      "alarma_01": -1,# validacion de [0,300 ]
      "alarma_02": -1,# validacion de [0,300 ]
      "alarma_03": -1,# validacion de [0,300 ]
      "alarma_04": -1,# validacion de [0,300 ]
      "alarma_05": -1,# validacion de [0,300 ]
      "alarma_06": -1,# validacion de [0,300 ]
      "alarma_07": -1,# validacion de [0,300 ]
      "alarma_08": -1,# validacion de [0,300 ]
      "alarma_09": -1,# validacion de [0,300 ]
      "alarma_10": -1,# validacion de [0,300 ]
      "imei": "ZGRUMAD00000001", 
      "ip": "10.239.31.146,13,0",
      "device": "UNIT111",
      "fecha": "2026-04-07T14:47:24.120000"
    },
    "hasta": "2026-04-07T14:47:24.120000", # ultima fecha recibida de datos de telemetria
    "ultima_fecha_encendido": "2026-04-02T10:28:41.845000",
    "ultima_fecha_apagado": "2026-04-02T02:28:41.845000",
    "ultimo_power_state": 1, 
    "fresh_air_ex_mode": {
        "modo_actual": 0,
        "fecha_modo_actual": "2026-04-02T10:28:41.845000",
        "ultimo_modo_0":{
                "desde" :"2026-04-02T10:28:41.845000",
                "hasta" : "2026-04-03T10:28:41.845000",
            }, 
        "ultimo_modo_1":{
                "desde" :"2026-03-12T10:28:41.845000",
                "hasta" : "2026-03-13T10:28:41.845000",
            }, 
        "ultimo_modo_2":{
                "desde" :"2026-03-22T10:28:41.845000",
                "hasta" : "2026-03-23T10:28:41.845000",
            } 
    },
    "alarmas": {
      "numero_alarma": 0,
      "activas": []
      "ultima_alarmas"=[
        "alarma_01":{
            "numero" :203,
            "desde" :"2026-04-01T01:28:41.845000",
            "hasta":"2026-04-06T01:29:41.845000"
        },
        "alarma_02":{
            "numero" :114,
            "desde" :"2026-04-01T03:28:41.845000",
            "hasta":"2026-04-06T04:29:41.845000"
        },
      ]
    },
    "compress_coil_1": {
      "estado": "normal",
      "valor_actual": 63.7,
      "fecha_inicio_estado": "2026-04-02T10:28:41.845000",
      "fecha_ultimo_critico": null,
      "fecha_ultimo_normal": "2026-04-02T10:28:41.845000"
    },
    "historico_set_point": [
        {
            "valor": 22.4,
            "desde": "2026-03-04T10:28:41.845000",
            "hasta": "2026-03-06T10:28:41.845000"
        },
        {
            "valor": 17,
            "desde": "2026-03-06T10:38:41.845000",
            "hasta": "2026-03-09T11:28:41.845000"
        }
    ],